{
  "audit_checksum": "93db90b45a26ebb1a4db73a0819068219ea687cb4dea337806d76ca3b8647aa5",
  "lineage": {
    "available_at": "2026-08-06T19:18:40.070000Z",
    "config_checksum": "a170aab2e8f71dd6f6420a308edd7aa22f6200a25f39ac1eacefb7ac1aa431a1",
    "entry_gate_checksum": "4034c86061234a627dafde6122439c3b697fb2d53a1b95ba4e58f77a71089e6d",
    "lineage_id": "lot43-reference-lineage-v1",
    "lot38_snapshot_checksum": "0d63ca7ac1ca48b44e58c0b0f1eb8946190eaf2da6745c2bbd2dd8de14f49b16",
    "lot39_book_checksum": "a503d56b312cbb21586712fcf929a0381cbc9adde9c5d70700e1f7166ef58dde",
    "lot39_delta_fixture_checksum": "1e7528a350ca78e21c4832b4af0ef4763e6bbadec82ea0f55a1005502cadff97",
    "lot42_audit_checksum": "b562b0cca61e0b10fbacf4a2318ef1075230b57388fe0240de0ca3d200582e3f",
    "lot42_state_checksum": "6e1fe348dc9fdc262d2f27990c6f3234f0b1ed71f5bfb3347fe27a9e458af8b0",
    "lot42_zone_set_checksum": "f5769313ec5f9f6de503b1eb9a40c31262ddf0eba6131f791c070f6557168c89",
    "schema_version": "lot43-lineage-envelope-v1"
  },
  "reason_codes": [
    "LOT43_AUDIT_COMPLETE",
    "LOT43_ANALYSIS_ONLY",
    "LOT43_NO_EXECUTION_AUTHORITY",
    "LOT44_REMAINS_LOCKED"
  ],
  "resilience_checksum": "ff314e1eecd40bca822b471f0239fdb8abb294375a8964a738131b71cba4b36e",
  "run_context": {
    "code_commit": "7193288022900d46b3f4058b9333f2a058d6ac6e",
    "config_version": "lot43-book-resilience-replenishment-config-v1",
    "correlation_id": "microstructure-v4-lot43-reference",
    "run_id": "lot43-reference-run-v1",
    "runtime_mode": "OFFLINE_MICROSTRUCTURE_RESEARCH_ONLY",
    "schema_version": "lot43-run-context-v1"
  },
  "safety": {
    "analysis_only": true,
    "approved_size": 0,
    "execution_allowed": false,
    "external_connectivity_allowed": false,
    "market_event_publication_allowed": false,
    "network_ingestion_allowed": false,
    "order_routing_allowed": false,
    "participant_behavior_inference_explicitly_labeled": true,
    "raw_data_mutation_allowed": false,
    "real_credentials_allowed": false,
    "risk_approval_allowed": false,
    "scenario_score_is_signal": false,
    "signal_generation_allowed": false,
    "trade_allowed": false,
    "used_for_decision": false
  },
  "schema_version": "book-resilience-replenishment-engine-audit-v1",
  "state_output_checksum": "18183ba147e4cff53a427a8d2c2f7507352b04de750f036ac2581a58a1f376b3",
  "validation_checks": [
    "entry_gate_verified",
    "lot42_frozen_lineage_verified",
    "lot39_canonical_prefix_replay_verified",
    "depletion_detection_verified",
    "same_and_adjacent_replenishment_verified",
    "directional_mid_shift_verified",
    "horizon_resilience_verified",
    "volatility_conditioning_verified",
    "participant_intent_not_inferred",
    "lot44_lock_preserved"
  ]
}
